{
  "schema_version": "1.0.0",
  "org_id": "org_demo",
  "plant_id": "plant_bhatia",
  "asset_id": "cell_vmc_12",
  "ts_utc": "2026-09-25T06:00:00Z",
  "state": "running",
  "program": "OP-10",
  "lineage": {
    "source_system": "fixture",
    "connector_id": "ctx-1",
    "pack_id": "generic-csv",
    "pack_version": "1.0.0",
    "source_record_id": "row-1"
  }
}
